{"SchemaVersion":"1.1","ToolVersion":"1.0.0","Left":{"FileName":"NPU_RAI1.5_280_WHQL.zip","Sha256":"a278a2c92cdc47e0da4cab2cbdb5347a127eee67311927578f4e151618446ce4"},"Right":{"FileName":"NPU_RAI_280_WHQL.zip","Sha256":"803afe1e2d75b717f60a368453306ccbd4877cdd936b6531b946b95109a22144"},"Counts":{"CommonIdentical":145,"CommonChanged":1,"OnlyLeft":0,"OnlyRight":1},"IdenticalFiles":["npu_mcdm_stack_prod/1x4.xclbin","npu_mcdm_stack_prod/1x4_2.5.0.0-518_ipu_2.xclbin","npu_mcdm_stack_prod/1x4_2.5.0.189-1.xclbin","npu_mcdm_stack_prod/1x4_2.5.0.259-365.xclbin","npu_mcdm_stack_prod/1x4_3.5.0.0-1482_ipu_2.xclbin","npu_mcdm_stack_prod/1x4_3.5.0.0-1505.xclbin","npu_mcdm_stack_prod/1x4_3.5.0.0-1791.xclbin","npu_mcdm_stack_prod/1x4_3.5.0.0-1793_ipu_2.xclbin","npu_mcdm_stack_prod/1x4_3.5.0.0-1990_ipu_2.xclbin","npu_mcdm_stack_prod/1x4_3.5.0.0-2044_ipu_2.xclbin","npu_mcdm_stack_prod/1x4_3.5.0.0-2145_ipu_2.xclbin","npu_mcdm_stack_prod/1x4_3.5.0.0-2351.xclbin","npu_mcdm_stack_prod/1x4_3.5.0.0-798.xclbin","npu_mcdm_stack_prod/1x4_3.5.0.0-947_ipu_2.xclbin","npu_mcdm_stack_prod/1x4_3.5.0.0-949.xclbin","npu_mcdm_stack_prod/1x4_3.5.0.050-650.xclbin","npu_mcdm_stack_prod/1x4_v0_122.xclbin","npu_mcdm_stack_prod/4x4_3.5.0.0-1483_ipu_2.xclbin","npu_mcdm_stack_prod/4x4_3.5.0.0-1506.xclbin","npu_mcdm_stack_prod/4x4_3.5.0.0-1792.xclbin","npu_mcdm_stack_prod/4x4_3.5.0.0-1794_ipu_2.xclbin","npu_mcdm_stack_prod/4x4_3.5.0.0-1987_ipu_2.xclbin","npu_mcdm_stack_prod/4x4_3.5.0.0-1989_ipu_2.xclbin","npu_mcdm_stack_prod/4x4_3.5.0.0-2046_ipu_2.xclbin","npu_mcdm_stack_prod/4x4_3.5.0.0-2160_ipu_2.xclbin","npu_mcdm_stack_prod/4x4_3.5.0.0-2352.xclbin","npu_mcdm_stack_prod/5x4_3.5.0.0-799.xclbin","npu_mcdm_stack_prod/5x4_3.5.0.0-950.xclbin","npu_mcdm_stack_prod/5x4_3.5.0.050-651.xclbin","npu_mcdm_stack_prod/AMD_AIE2P_4x4_Overlay_3.5.0.0-2354_ipu_2.xclbin","npu_mcdm_stack_prod/AMD_AIE2P_4x4_Overlay_CFG0_3.5.0.0-2229_ipu_2.xclbin","npu_mcdm_stack_prod/AMD_AIE2P_Nx4_Overlay_3.5.0.0-2353_ipu_2.xclbin","npu_mcdm_stack_prod/DPU_Sequence/aie_reconfig_overhead.txt","npu_mcdm_stack_prod/DPU_Sequence/df_bw.txt","npu_mcdm_stack_prod/DPU_Sequence/gemm_int8.txt","npu_mcdm_stack_prod/DPU_Sequence/tct_1col.txt","npu_mcdm_stack_prod/DPU_Sequence/tct_4col.txt","npu_mcdm_stack_prod/ELF/aie_reconfig_overhead_17f0_10.elf","npu_mcdm_stack_prod/ELF/aie_reconfig_overhead_17f0_11.elf","npu_mcdm_stack_prod/ELF/aie_reconfig_overhead_17f0_20.elf","npu_mcdm_stack_prod/ELF/df_bw_17f0_10.elf","npu_mcdm_stack_prod/ELF/df_bw_17f0_11.elf","npu_mcdm_stack_prod/ELF/df_bw_17f0_20.elf","npu_mcdm_stack_prod/ELF/gemm_int8_17f0_10.elf","npu_mcdm_stack_prod/ELF/gemm_int8_17f0_11.elf","npu_mcdm_stack_prod/ELF/gemm_int8_17f0_20.elf","npu_mcdm_stack_prod/ELF/mobilenet_4col_17f0_10.elf","npu_mcdm_stack_prod/ELF/mobilenet_4col_17f0_11.elf","npu_mcdm_stack_prod/ELF/mobilenet_4col_17f0_20.elf","npu_mcdm_stack_prod/ELF/nop_17f0_10.elf","npu_mcdm_stack_prod/ELF/nop_17f0_11.elf","npu_mcdm_stack_prod/ELF/nop_17f0_20.elf","npu_mcdm_stack_prod/ELF/preemption_memtile_4x4.elf","npu_mcdm_stack_prod/ELF/preemption_memtile_4x8.elf","npu_mcdm_stack_prod/ELF/preemption_noop_4x4.elf","npu_mcdm_stack_prod/ELF/preemption_noop_4x8.elf","npu_mcdm_stack_prod/ELF/tct_1col_17f0_10.elf","npu_mcdm_stack_prod/ELF/tct_1col_17f0_11.elf","npu_mcdm_stack_prod/ELF/tct_1col_17f0_20.elf","npu_mcdm_stack_prod/ELF/tct_4col_17f0_10.elf","npu_mcdm_stack_prod/ELF/tct_4col_17f0_11.elf","npu_mcdm_stack_prod/ELF/tct_4col_17f0_20.elf","npu_mcdm_stack_prod/Mobilenet/buffer_sizes.json","npu_mcdm_stack_prod/Mobilenet/mobilenet_ifm.bin","npu_mcdm_stack_prod/Mobilenet/mobilenet_param.bin","npu_mcdm_stack_prod/RadeonML.dll","npu_mcdm_stack_prod/RadeonML_DirectML.dll","npu_mcdm_stack_prod/RadeonML_IPU.dll","npu_mcdm_stack_prod/RadeonML_aks.dll","npu_mcdm_stack_prod/aie2p_gemm_strix_4x2_bf16.json","npu_mcdm_stack_prod/aie2p_gemm_strix_4x2_bf16.xclbin","npu_mcdm_stack_prod/aie2p_gemm_vm_strix_4x4.json","npu_mcdm_stack_prod/aie2p_gemm_vm_strix_4x4.xclbin","npu_mcdm_stack_prod/aieml_gemm_asr.json","npu_mcdm_stack_prod/aieml_gemm_asr.xclbin","npu_mcdm_stack_prod/aieml_gemm_asr_qdq.json","npu_mcdm_stack_prod/aieml_gemm_asr_qdq.xclbin","npu_mcdm_stack_prod/aieml_gemm_vm_phx_4x4.json","npu_mcdm_stack_prod/aieml_gemm_vm_phx_4x4.xclbin","npu_mcdm_stack_prod/aieml_gemm_vm_phx_4x4_bf16.json","npu_mcdm_stack_prod/aieml_gemm_vm_phx_4x4_bf16.xclbin","npu_mcdm_stack_prod/aks.dll","npu_mcdm_stack_prod/akskernels.dll","npu_mcdm_stack_prod/amd_taau_ops.rml_plugin.dll","npu_mcdm_stack_prod/benchmark_17f0_10.json","npu_mcdm_stack_prod/benchmark_17f0_11.json","npu_mcdm_stack_prod/benchmark_17f0_20.json","npu_mcdm_stack_prod/config_xclbin.txt","npu_mcdm_stack_prod/gemm_17f0_10.xclbin","npu_mcdm_stack_prod/gemm_17f0_11.xclbin","npu_mcdm_stack_prod/gemm_17f0_20.xclbin","npu_mcdm_stack_prod/gemm_elf_17f0_10.xclbin","npu_mcdm_stack_prod/gemm_elf_17f0_11.xclbin","npu_mcdm_stack_prod/gemm_elf_17f0_20.xclbin","npu_mcdm_stack_prod/ipu_2_pasid.sbin","npu_mcdm_stack_prod/ipu_3_pasid.sbin","npu_mcdm_stack_prod/ipu_4_pasid.sbin","npu_mcdm_stack_prod/ipu_pasid.sbin","npu_mcdm_stack_prod/ipustack.sys","npu_mcdm_stack_prod/kipudrv.cat","npu_mcdm_stack_prod/kipudrv.inf","npu_mcdm_stack_prod/mobilenet_elf_17f0_10.xclbin","npu_mcdm_stack_prod/mobilenet_elf_17f0_11.xclbin","npu_mcdm_stack_prod/mobilenet_elf_17f0_20.xclbin","npu_mcdm_stack_prod/preemption_4x4_17f0.xclbin","npu_mcdm_stack_prod/preemption_4x8_17f0.xclbin","npu_mcdm_stack_prod/qdq.1x4_3.5.0.0-1481_ipu_2.xclbin","npu_mcdm_stack_prod/rml/include/rml/RadeonML.h","npu_mcdm_stack_prod/rml/include/rml/RadeonML.hpp","npu_mcdm_stack_prod/rml/include/rml/RadeonML_cl.h","npu_mcdm_stack_prod/rml/include/rml/RadeonML_cl.hpp","npu_mcdm_stack_prod/rml/include/rml/RadeonML_d3d12.h","npu_mcdm_stack_prod/rml/include/rml/RadeonML_d3d12.hpp","npu_mcdm_stack_prod/rml/include/rml/RadeonML_dml.h","npu_mcdm_stack_prod/rml/include/rml/RadeonML_dml.hpp","npu_mcdm_stack_prod/rml/include/rml/RadeonML_graph.h","npu_mcdm_stack_prod/rml/include/rml/RadeonML_miopen.h","npu_mcdm_stack_prod/rml/include/rml/RadeonML_miopen.hpp","npu_mcdm_stack_prod/rml/include/rml/RadeonML_mtl.h","npu_mcdm_stack_prod/rml/include/rml/RadeonML_mtl.hpp","npu_mcdm_stack_prod/rml/include/rml/RadeonML_utils.hpp","npu_mcdm_stack_prod/rml/tools/rml_amodel.lib","npu_mcdm_stack_prod/rml/tools/rml_amodel_api.h","npu_mcdm_stack_prod/rml/tools/rml_amodel_pkgr.exe","npu_mcdm_stack_prod/rml/tools/rml_amodel_unpkgr.exe","npu_mcdm_stack_prod/rml/tools/sample_win32.config","npu_mcdm_stack_prod/rml/tools/tracelogging.WPRP","npu_mcdm_stack_prod/rml/windows/RadeonML.lib","npu_mcdm_stack_prod/trace-logging-aks.dll","npu_mcdm_stack_prod/validate_1502_00.xclbin","npu_mcdm_stack_prod/validate_17f0_00.xclbin","npu_mcdm_stack_prod/validate_17f0_10.xclbin","npu_mcdm_stack_prod/validate_17f0_11.xclbin","npu_mcdm_stack_prod/validate_17f0_20.xclbin","npu_mcdm_stack_prod/validate_elf_17f0_10.xclbin","npu_mcdm_stack_prod/validate_elf_17f0_11.xclbin","npu_mcdm_stack_prod/validate_elf_17f0_20.xclbin","npu_mcdm_stack_prod/vitis-ai-runtime.dll","npu_mcdm_stack_prod/vitis-ai-runtime2.dll","npu_mcdm_stack_prod/xdp_core.dll","npu_mcdm_stack_prod/xdp_ml_timeline_plugin.dll","npu_mcdm_stack_prod/xdp_user_plugin.dll","npu_mcdm_stack_prod/xrt-smi.exe","npu_mcdm_stack_prod/xrt_core.dll","npu_mcdm_stack_prod/xrt_coreutil.dll"],"ChangedFiles":[{"Path":"npu_sw_installer.exe","LeftSha256":"70259d1d182d7e9413cfb3cb8608bcba16f8142c6aee96fac2df2feb99366016","RightSha256":"96dc03e574e9dfb2c45543833d8a66d5bcecb9af48e9beac07ea72cccf3ce755","LeftLength":491728,"RightLength":595208}],"OnlyLeft":[],"OnlyRight":["ryzen-ai-end-user-license-agreement-public.pdf"],"InstallerBinaryRelationship":"DifferentOrMissing","InstallerRoutingRelationship":"SameRecoveredRoutingSemantics","DriverBinaryRelationship":"ByteIdentical","DriverIdentityLogicRelationship":"ExactHashIdentical"}
